{
  "$schema": "https://json-schema.org/draft/2020-12/schema",
  "$id": "https://contratos.kamba.ao/eventos/catalog.price_changed/v1.schema.json",
  "title": "catalog.price_changed v1",
  "type": "object",
  "additionalProperties": false,
  "required": [
    "id",
    "tipo",
    "versao",
    "tenant_id",
    "ocorrido_em",
    "registado_em",
    "produtor",
    "agregado",
    "correlacao_id",
    "causa_id",
    "trace_id",
    "classe_pii",
    "finalidades",
    "payload"
  ],
  "properties": {
    "id": {
      "type": "string",
      "format": "uuid",
      "description": "UUIDv7 do evento. Chave global de idempotencia."
    },
    "tipo": {
      "type": "string",
      "const": "catalog.price_changed"
    },
    "versao": {
      "type": "integer",
      "const": 1
    },
    "tenant_id": {
      "type": "string",
      "format": "uuid"
    },
    "ocorrido_em": {
      "type": "string",
      "format": "date-time"
    },
    "registado_em": {
      "type": "string",
      "format": "date-time"
    },
    "produtor": {
      "type": [
        "string",
        "null"
      ]
    },
    "agregado": {
      "type": "object",
      "additionalProperties": false,
      "required": [
        "tipo",
        "id",
        "seq"
      ],
      "properties": {
        "tipo": {
          "type": "string",
          "const": "product"
        },
        "id": {
          "type": "string"
        },
        "seq": {
          "type": "integer",
          "minimum": 1
        }
      }
    },
    "correlacao_id": {
      "type": [
        "string",
        "null"
      ],
      "format": "uuid"
    },
    "causa_id": {
      "type": [
        "string",
        "null"
      ],
      "format": "uuid"
    },
    "trace_id": {
      "type": [
        "string",
        "null"
      ]
    },
    "classe_pii": {
      "type": "string",
      "enum": [
        "P0"
      ]
    },
    "finalidades": {
      "type": "array",
      "minItems": 1,
      "uniqueItems": true,
      "items": {
        "type": "string",
        "enum": [
          "transacao",
          "atendimento",
          "marketing",
          "analytics_agregado",
          "melhoria_servico",
          "sugestoes_patrocinadas",
          "partilha_loja",
          "partilha_parceiros"
        ]
      }
    },
    "payload": {
      "type": "object",
      "additionalProperties": false,
      "required": [
        "sku",
        "preco_tipo",
        "currency"
      ],
      "properties": {
        "sku": {
          "type": "string"
        },
        "preco_tipo": {
          "type": "string",
          "enum": [
            "fixo",
            "a_partir_de",
            "sob_consulta"
          ]
        },
        "preco_minor": {
          "type": [
            "integer",
            "null"
          ],
          "minimum": 0
        },
        "currency": {
          "type": "string",
          "enum": [
            "AOA"
          ]
        }
      }
    }
  }
}
